<?xml version='1.0' encoding='UTF-8'?>
<sdf3 type='fsmsadf' xmlns:xsi='http://www.w3.org/2001/XMLSchema-instance' 
    xmlns='uri:sdf3' version='1.0' 
    xsi:schemaLocation='uri:sdf3 http://www.es.ele.tue.nl/sdf3/xsd/sdf3-fsmsadf.xsd'>
    <applicationGraph name='mp3decoder'>
        <fsmsadf>
          <scenariograph name='mp3decoder-ll' type='MP3DECODER-LL'>
            <actor name="Feed" type="Feed" repetitions="0">
              <port name="Out_FD2SP" type="out" rate="1"></port>
              <!--<port name="Self_In" type="in" rate="1"></port>
              <port name="Self_Out" type="out" rate="1"></port>-->
              <!--<port name="SC_In" type="in" rate="2"></port>-->
            </actor>
            <actor name="Play" type="Play" repetitions="2">
              <port name="In_WB2PL" type="in" rate="1"></port>
              <port name="Self_In" type="in" rate="1"></port>
              <port name="Self_Out" type="out" rate="1"></port>
              <!--<port name="SC_In" type="in" rate="1"></port>-->
            </actor>
            <actor name="Splitter" type="Splitter" repetitions="1">
              <port name="In_FD2SP" type="in" rate="1"></port>
              <port name="Out_SP2RQR" type="out" rate="2"></port>
              <port name="Out_SP2RQL" type="out" rate="2"></port>
              <port name="Res2_In" type="in" rate="1"></port>
            </actor>
            <actor name="ReQuantizationLeft" type="ReQuantizationLeft" repetitions="2">
              <port name="In_SP2RQL" type="in" rate="1"></port>
              <port name="Out_RQL2S" type="out" rate="1"></port>
              <port name="Res_In" type="in" rate="1"></port>
              <port name="Res_Out" type="out" rate="1"></port>
            </actor>
            <actor name="ReQuantizationRight" type="ReQuantizationRight" repetitions="2">
              <port name="In_SP2RQR" type="in" rate="1"></port>
              <port name="Out_RQR2S" type="out" rate="1"></port>
              <port name="Res_In" type="in" rate="1"></port>
            </actor>
            <actor name="Stereo" type="Stereo" repetitions="2">
              <port name="In_RQR2S" type="in" rate="1"></port>
              <port name="In_RQL2S" type="in" rate="1"></port>
              <port name="Out_S2AAR" type="out" rate="32"></port>
              <port name="Out_S2AAL" type="out" rate="32"></port>
              <port name="Res_Out" type="out" rate="1"></port>
              <port name="Res2_Out" type="out" rate="1"></port>
              <!--<port name="DummyL_Out" type="out" rate="1"></port>
              <port name="DummyR_Out" type="out" rate="1"></port>-->
            </actor>
            <actor name="ParkDec" type="ParkDec" repetitions="0">
              <port name="Self_Out" type="out" rate="1"></port>
              <port name="Self_In" type="in" rate="1"></port>
            </actor>
            <actor name="Sync1" type="Sync1" repetitions="1">
              <port name="Res2_In" type="in" rate="2"></port>
              <port name="Res2_Out" type="out" rate="1"></port>
            </actor>
            <actor name="AntiAliasLeft" type="AntiAliasLeft" repetitions="64">
              <port name="In_S2AAL" type="in" rate="1"></port>
              <port name="Out_AAL2IDL" type="out" rate="1"></port>
              <port name="Res1_In" type="in" rate="1"></port>
              <port name="Res32_In" type="in" rate="1"></port>
            </actor>
            <actor name="AntiAliasRight" type="AntiAliasRight" repetitions="64">
              <port name="In_S2AAR" type="in" rate="1"></port>
              <port name="Out_AAR2IDR" type="out" rate="1"></port>
              <port name="Res1_In" type="in" rate="1"></port>
              <port name="Res32_In" type="in" rate="1"></port>
            </actor>
            <actor name="IMDCTLeft" type="IMDCTLeft" repetitions="64">
              <port name="In_AAL2IDL" type="in" rate="1"></port>
              <port name="Out_IDL2FIL" type="out" rate="1"></port>
            </actor>
            <actor name="IMDCTRight" type="IMDCTRight" repetitions="64">
              <port name="In_AAR2IDR" type="in" rate="1"></port>
              <port name="Out_IDR2FIR" type="out" rate="1"></port>
            </actor>
            <actor name="FrequencyInversionLeft" type="FrequencyInversionLeft" repetitions="64">
              <port name="In_IDL2FIL" type="in" rate="1"></port>
              <port name="Out_FIL2PSL" type="out" rate="1"></port>
              <port name="Res1_Out" type="out" rate="1"></port>
            </actor>
            <actor name="FrequencyInversionRight" type="FrequencyInversionRight" repetitions="64">
              <port name="In_IDR2FIR" type="in" rate="1"></port>
              <port name="Out_FIR2PSR" type="out" rate="1"></port>
              <port name="Res1_Out" type="out" rate="1"></port>
            </actor>
            <actor name="PolySynthLeft" type="PolySynthLeft" repetitions="2">
              <port name="In_FIL2PSL" type="in" rate="32"></port>
              <port name="Out_PSL2WB" type="out" rate="1"></port>
              <port name="Res32_Out" type="out" rate="1"></port>
            </actor>
            <actor name="PolySynthRight" type="PolySynthRight" repetitions="2">
              <port name="In_FIR2PSR" type="in" rate="32"></port>
              <port name="Out_PSR2WB" type="out" rate="1"></port>
            </actor>
            <actor name="WriteBack" type="WriteBack" repetitions="2">
              <port name="In_PSR2WB" type="in" rate="1"></port>
              <port name="In_PSL2WB" type="in" rate="1"></port>
              <port name="Out_WB2PL" type="out" rate="1"></port>
              <port name="Res32_Out" type="out" rate="1"></port>
            </actor>
            <actor name="Sync2" type="Sync2" repetitions="2">
              <port name="Res32_In" type="in" rate="1"></port>
              <port name="Res32_Out" type="out" rate="32"></port>
            </actor>
            <actor name="Sync3" type="Sync3" repetitions="2">
              <port name="Res32_In" type="in" rate="1"></port>
              <port name="Res32_Out" type="out" rate="32"></port>
            </actor>
            <!--<channel name="Self_Feed" srcActor="Feed" srcPort="Self_Out" dstActor="Feed" dstPort="Self_In" initialTokens="1" persistentTokenNames="start" finalTokens="1" persistentFinalTokenNames="start"></channel>-->
            <channel name="FD2SP" srcActor="Feed" srcPort="Out_FD2SP" dstActor="Splitter" dstPort="In_FD2SP" initialTokens="1" persistentTokenNames="start" finalTokens="0" />
            <channel name="Res1_SY12SP" srcActor="Sync1" srcPort="Res2_Out" dstActor="Splitter" dstPort="Res2_In" initialTokens="1" persistentTokenNames="B" finalTokens="1" persistentFinalTokenNames="B"></channel>
            <channel name="Res2_PSL2SY2" srcActor="PolySynthLeft" srcPort="Res32_Out" dstActor="Sync2" dstPort="Res32_In" initialTokens="1" persistentTokenNames="C" finalTokens="1" persistentFinalTokenNames="C"></channel>
            <channel name="Res3_WB2SY3" srcActor="WriteBack" srcPort="Res32_Out" dstActor="Sync3" dstPort="Res32_In" initialTokens="1" persistentTokenNames="D" finalTokens="1" persistentFinalTokenNames="D"></channel>
            <channel name="Self_Play" srcActor="Play" srcPort="Self_Out" dstActor="Play" dstPort="Self_In" initialTokens="1" persistentTokenNames="play" finalTokens="1" persistentFinalTokenNames="play"></channel>
            <channel name="Res1_S2RQL" srcActor="Stereo" srcPort="Res_Out" dstActor="ReQuantizationLeft" dstPort="Res_In" initialTokens="1"></channel>
            <channel name="Res2_FIL2AAL" srcActor="FrequencyInversionLeft" srcPort="Res1_Out" dstActor="AntiAliasLeft" dstPort="Res1_In" initialTokens="1"></channel>
            <channel name="Res3_FIR2AAR" srcActor="FrequencyInversionRight" srcPort="Res1_Out" dstActor="AntiAliasRight" dstPort="Res1_In" initialTokens="1"></channel>
            <channel name="ParkVLDToken" srcActor="ParkDec" srcPort="Self_Out" dstActor="ParkDec" dstPort="Self_In" initialTokens="1" persistentTokenNames="Dec" finalTokens="1" persistentFinalTokenNames="Dec"></channel>
            <!--<channel name="S2DL" srcActor="Stereo" srcPort="DummyL_Out" dstActor="DummyL" dstPort="Stereo_In"></channel>
            <channel name="S2DR" srcActor="Stereo" srcPort="DummyR_Out" dstActor="DummyR" dstPort="Stereo_In"></channel>-->
            <channel name="SP2RQL" srcActor="Splitter" srcPort="Out_SP2RQL" dstActor="ReQuantizationLeft" dstPort="In_SP2RQL"></channel>
            <channel name="SP2RQR" srcActor="Splitter" srcPort="Out_SP2RQR" dstActor="ReQuantizationRight" dstPort="In_SP2RQR"></channel>
            <channel name="RQL2S" srcActor="ReQuantizationLeft" srcPort="Out_RQL2S" dstActor="Stereo" dstPort="In_RQL2S"></channel>
            <channel name="Res1_RQL2RQR" srcActor="ReQuantizationLeft" srcPort="Res_Out" dstActor="ReQuantizationRight" dstPort="Res_In"></channel>
            <channel name="RQR2S" srcActor="ReQuantizationRight" srcPort="Out_RQR2S" dstActor="Stereo" dstPort="In_RQR2S"></channel>
            <channel name="Res1_S2SY1" srcActor="Stereo" srcPort="Res2_Out" dstActor="Sync1" dstPort="Res2_In"></channel>
            <channel name="S2AAL" srcActor="Stereo" srcPort="Out_S2AAL" dstActor="AntiAliasLeft" dstPort="In_S2AAL"></channel>
            <channel name="S2AAR" srcActor="Stereo" srcPort="Out_S2AAR" dstActor="AntiAliasRight" dstPort="In_S2AAR"></channel>
            <channel name="AAL2IDL" srcActor="AntiAliasLeft" srcPort="Out_AAL2IDL" dstActor="IMDCTLeft" dstPort="In_AAL2IDL"></channel>
            <channel name="AAR2IDR" srcActor="AntiAliasRight" srcPort="Out_AAR2IDR" dstActor="IMDCTRight" dstPort="In_AAR2IDR"></channel>
            <channel name="IDL2FIL" srcActor="IMDCTLeft" srcPort="Out_IDL2FIL" dstActor="FrequencyInversionLeft" dstPort="In_IDL2FIL"></channel>